instruction,output
在法律中定金与订金的区别订金和定金哪个受,“定金”是指当事人约定由一方向对方给付的，作为债权担保的一定数额的货币，它属于一种法律上的担保方式，目的在于促使债务人履行债务，保障债权人的债权得以实现。签合同时，对定金必需以书面形式进行约定，同时还应约定定金的数额和交付期限。给付定金一方如果不履行债务，无权要求另一方返还定金；接受定金的一方如果不履行债务，需向另一方双倍返还债务。债务人履行债务后，依照约定，定金应抵作价款或者收回。而“订金”目前我国法律没有明确规定，它不具备定金所具有的担保性质，可视为“预付款”，当合同不能履行时，除不可抗力外，应根据双方当事人的过错承担违约责任。
盗窃罪的犯罪客体是什么，盗窃罪的犯罪主体,盗窃罪的客体要件本罪侵犯的客体是公私财物的所有权。侵犯的对象，是国家、集体或个人的财物，一般是指动产而言，但不动产上之附着物，可与不动产分离的，例如，田地上的农作物，山上的树木、建筑物上之门窗等，也可以成为本罪的对象。另外，能源如电力、煤气也可成为本罪的对象。盗窃罪侵犯的客体是公私财物的所有权。所有权包括占有、使用、收益、处分等权能。这里的所有权一般指合法的所有权，但有时也有例外情况。根据《最高人民法院关于审理盗窃案件具体应用法律若干问题的解释》(以下简称《解释》)的规定：“盗窃违禁品，按盗窃罪处理的，不计数额，根据情节轻重量刑。盗窃违禁品或犯罪分子不法占有的财物也构成盗窃罪。”
非法微整形机构构成非法经营罪吗,符合要件就有可能。非法经营罪，是指未经许可经营专营、专卖物品或其他限制买卖的物品，买卖进出口许可证、进出口原产地证明以及其他法律、行政法规规定的经营许可证或者批准文件，以及从事其他非法经营活动，扰乱市场秩序，情节严重的行为。
入室持刀行凶伤人能不能判刑,对于入室持刀伤人涉嫌故意伤害刑事犯罪，一经定罪，故意伤害他人身体的，处三年以下有期徒刑、拘役或者管制。犯前款罪，致人重伤的，处三年以上十年以下有期徒刑；致人死亡或者以特别残忍手段致人重伤造成严重残疾的，处十年以上有期徒刑、无期徒刑或者死刑。相关法律规定《中华人民共和国刑法》第二百三十四条故意伤害他人身体的，处三年以下有期徒刑、拘役或者管制。犯前款罪，致人重伤的，处三年以上十年以下有期徒刑；致人死亡或者以特别残忍手段致人重伤造成严重残疾的，处十年以上有期徒刑、无期徒刑或者死刑。本法另有规定的，依照规定。
我在辅道正常右转进主道，主道有两个车，后面的车占用对向车道超车，撞了是谁的责任,发生交通事故，及时报警，有交警划分责任，出具交通事故认定书，根据责任的划分和损害情况协商解决，协商不成的必要时可以诉讼处理。
对交通事故责任认定书不服怎么办，交通事故损,事故认定书下发后，如果你对认定不满意，可在接到认定书3日内到上一级公安机关复议。
喝完就又去唱歌回家时去了车祸去唱歌我同意了车是我开的,需要结合具体情况判断，看是否酒驾和交通事故责任的划分，根据责任承担责任，赔偿损失。
二审一般要多久,《民事诉讼法》对二审的审限作出了规定，一般会在立案一个月内开庭，在三个月内审结，但最长也可以超过三个月。《民事诉讼法》第一百七十六条人民法院审理对判决的上诉案件，应当在第二审立案之日起三个月内审结。有特殊情况需要延长的，由本院院长批准。人民法院审理对裁定的上诉案件，应当在第二审立案之日起三十日内作出终审裁定。
欠钱没有欠条有录音能起诉吗,录音资料经过鉴定证实未经剪辑、拼凑、篡改和臆造，并有其他相关证据相印证的，可以认定其效力。
